<?xml version="1.0" encoding="UTF-8"?>

<!DOCTYPE ServicioTecnicoMoviles SYSTEM "ReparacionInfoReply.dtd">
<ServicioTecnicoMoviles>
    <head>
        <action>REPARACION_INFO_REPLY</action>
        <ask result="">
    </head>
    <body>
        <modelo_id></modelo_id>
    	<reparaciones>
    		<reparacion id="">
    			<nombre></nombre>
    			<tiempo></tiempo>
    			<coste></coste>
    		</reparacion>
    	</reparaciones>
    </body>
</ServicioTecnicoMoviles>
